,index,id,titulo,empresa,nivel_da_vaga,link,data_publi,salario_vg,cidade_vg,descr3_vg,descr2_vg
0,117,v2460155,Analista da Qualidade Pleno,SGS,Pleno,https://www.vagas.com.br/vagas/v2460155/analista-da-qualidade-pleno,Publicada em 23/11/2022,a combinar,São Bernardo do Campo,"Empresa
A SGS é líder mundial em inspeção, verificação, testes e certificação. Somos reconhecidos como referência mundial em qualidade e integridade. Com mais de 94.000 funcionários, operamos uma rede com mais de 2.600 escritórios e laboratórios no mundo todo.","Descrição

Descrição:
Manter atualizados os documentos controlados (físicos e eletrônicos) necessários ao sistema de gestão, assim bem como banco de dados locais (team site);
Registrar, Monitorar e prover folow up adequado no andamento das Oportunidades de Melhoria pertinentes ao seu escopo de atuação;
Controlar e Manter as atividades de calibração e verificação de equipamentos de medição, inspeção e ensaios;
Controlar e Manter as atividades de Treinamento e Desenvolvimento as Competências das equipes;
Relatar e Providenciar junto as áreas de suporte adequações de infraestrutura e meio ambiente que possam ser prejudiciais à realização dos serviços;
Monitorar processos aplicados à prestação de serviços, atuando junto aos gestores dos mesmos quando de desvios aos resultados esperados, treinando/reciclando os envolvidos quando necessário;
Seguir os protocolos estabelecidos de prevenção à poluição, saúde e segurança do trabalho estabelecido para sua área;
Coordenar atividades de Auditorias Interna.

Outros requisitos:
Conhecimento em estatística e Metrologia (desejável);
Desejável experiência em análises químicas e físicas;
Conhecimento nível usuário de Internet; Word, Excel, Outlook e Sharepoint;
Conhecimento ISO17025"
